{
  "$schema": "https://json-schema.org/draft/2020-12/schema",
  "$id": "https://kiln.dev/agent-protocol/commands/net.firewall.apply.schema.json",
  "title": "net.firewall.apply — full nftables ruleset for table inet kiln (rendered to /etc/kiln/nftables.conf, checked with nft -c, applied with nft -f)",
  "x-kiln-redeliverable": true,
  "type": "object",
  "additionalProperties": false,
  "required": [
    "rules"
  ],
  "properties": {
    "input_policy": {
      "enum": [
        "drop",
        "accept"
      ],
      "default": "drop"
    },
    "ssh_port": {
      "type": "integer",
      "minimum": 1,
      "maximum": 65535,
      "default": 22,
      "description": "Always accepted to avoid lock-out"
    },
    "allow_icmp": {
      "type": "boolean",
      "default": true
    },
    "rules": {
      "type": "array",
      "items": {
        "type": "object",
        "additionalProperties": false,
        "required": [
          "id"
        ],
        "properties": {
          "id": {
            "type": "string",
            "pattern": "^[A-Za-z0-9_-]+$"
          },
          "action": {
            "enum": [
              "accept",
              "drop",
              "reject"
            ],
            "default": "accept"
          },
          "protocol": {
            "enum": [
              "tcp",
              "udp",
              "any"
            ],
            "default": "tcp"
          },
          "ports": {
            "type": "array",
            "items": {
              "type": "string",
              "pattern": "^[0-9]{1,5}(-[0-9]{1,5})?$"
            },
            "description": "Empty = all ports"
          },
          "sources": {
            "type": "array",
            "items": {
              "type": "string",
              "description": "IPv4/IPv6 address or CIDR"
            },
            "description": "Empty = anywhere"
          },
          "interface": {
            "type": "string",
            "pattern": "^[A-Za-z0-9_.-]+$"
          },
          "comment": {
            "type": "string",
            "maxLength": 120
          }
        }
      }
    },
    "container_ports": {
      "type": "array",
      "description": "feature db.containers: host ports the server's containers may reach. Accepted on the Docker bridges only (iifname docker0 and br-*) from sources, then dropped from everywhere else — before the private-network and user rules, so only loopback and containers reach them. Peers (feature db.redis.network): addresses of other servers also accepted for the ports, on any interface, ahead of the drop.",
      "items": {
        "type": "object",
        "additionalProperties": false,
        "required": [
          "id",
          "ports"
        ],
        "properties": {
          "id": {
            "type": "string",
            "pattern": "^[A-Za-z0-9_-]+$"
          },
          "protocol": {
            "enum": [
              "tcp",
              "udp",
              "any"
            ],
            "default": "tcp"
          },
          "sources": {
            "type": "array",
            "minItems": 0,
            "items": {
              "type": "string",
              "description": "Docker address range (CIDR); sources or peers must not be empty"
            }
          },
          "peers": {
            "type": "array",
            "items": {
              "type": "string",
              "description": "IPv4/IPv6 address or CIDR of a server allowed to reach the ports (private network / provider private address)"
            }
          },
          "ports": {
            "type": "array",
            "minItems": 1,
            "items": {
              "type": "string",
              "pattern": "^[0-9]{1,5}(-[0-9]{1,5})?$"
            }
          },
          "comment": {
            "type": "string",
            "maxLength": 120
          }
        }
      }
    }
  },
  "$defs": {
    "result": {
      "type": "object",
      "additionalProperties": false,
      "required": [
        "changed"
      ],
      "properties": {
        "changed": {
          "type": "boolean",
          "description": "true when the host state was modified"
        },
        "ruleset_sha256": {
          "type": "string",
          "pattern": "^[a-f0-9]{64}$"
        }
      }
    }
  }
}
