{"input_policy": "drop", "ssh_port": 22, "allow_icmp": true, "rules": [{"id": "http", "action": "accept", "protocol": "tcp", "ports": ["80", "443"], "comment": "web"}, {"id": "http3", "protocol": "udp", "ports": ["443"]}, {"id": "mysql-private", "protocol": "tcp", "ports": ["3306"], "sources": ["10.90.0.0/24"], "interface": "wg-kiln"}, {"id": "wg", "protocol": "udp", "ports": ["51820"]}], "container_ports": [{"id": "postgresql", "protocol": "tcp", "ports": ["5432"], "sources": ["172.16.0.0/12", "192.168.0.0/16"], "comment": "PostgreSQL for containers"}, {"id": "redis-cache", "protocol": "tcp", "ports": ["6380"], "sources": ["172.16.0.0/12"], "peers": ["10.90.0.2", "10.0.1.7"], "comment": "Redis cache"}]}
